<?xml version="1.0" encoding="UTF-8"?>
<generator xmlns="http://www.renlm.cn/schema/generator"
	xmlns:xsi="http://www.w3.org/2001/XMLSchema-instance"
	xsi:schemaLocation="http://www.renlm.cn/schema/generator http://114.67.87.80/schema/generator.xsd">

	<url>jdbc:mysql://114.67.87.80:3308/crawler?serverTimezone=Asia/Shanghai</url>
	<username>crawler</username>
	<password>crawler@(ddf_^)</password>
	<driverName>com.mysql.cj.jdbc.Driver</driverName>

	<module name="sys" package="cn.renlm.crawler">
		<table author="Renlm" name="sys_user" ignore="true" />
		<table author="任黎明" name="sys_user_role" ignore="true" />
		<table author="任黎明" name="sys_role" ignore="true" />
		<table author="任黎明" name="sys_role_resource" ignore="true" />
		<table author="任黎明" name="sys_resource" ignore="true" />
	</module>

	<module name="log" package="cn.renlm.crawler">
		<table ignore="true" author="任黎明" name="log_quartz" />
		<table ignore="true" author="任黎明" name="log_oshi" />
		<table ignore="false" author="任黎明" name="log_login" />
	</module>
</generator>